country_abbr,country_name,region_code,region_name,cmpcode,acronym,party_orig,party_engl,year,mani_title
DE,Deutschland,6,Hessen,41953,AfD,Alternative für Deutschland,Alternative for Germany,2013,Leitlinien der AfD Hessern für den Landtagswahlkampf 2013
DE,Deutschland,6,Hessen,41521,CDU,Christlich Demokratische Union,Christian Democratic Union,1978,Wahlprogramm
DE,Deutschland,6,Hessen,41521,CDU,Christlich Demokratische Union,Christian Democratic Union,1982,"Mut zur Zukunft, Mut für die 80er Jahre!"
DE,Deutschland,6,Hessen,41521,CDU,Christlich Demokratische Union,Christian Democratic Union,1983,"Mut zur Zukunft, Mut für die 80er Jahre!"
DE,Deutschland,6,Hessen,41521,CDU,Christlich Demokratische Union,Christian Democratic Union,1987,Programm zur Landtagswahl 1987
DE,Deutschland,6,Hessen,41521,CDU,Christlich Demokratische Union,Christian Democratic Union,1991,Hessen geht vor!
DE,Deutschland,6,Hessen,41521,CDU,Christlich Demokratische Union,Christian Democratic Union,1995,Regierungsprogramm der CDU Hessen zur Landtagswahl 1995. Hessen braucht eine bessere Regierung
DE,Deutschland,6,Hessen,41521,CDU,Christlich Demokratische Union,Christian Democratic Union,1999,Hessens Zukunft entschlossen gestalten! Programm zur Landtagswahl 1999
DE,Deutschland,6,Hessen,41521,CDU,Christlich Demokratische Union,Christian Democratic Union,2003,Hessen auf dem Weg zur Nr.1 – viel getan – viel zu tun. Landtagswahlprogramm 2003 der CDU Hessen
DE,Deutschland,6,Hessen,41521,CDU,Christlich Demokratische Union,Christian Democratic Union,2008,Mutig. Modern. Menschlich. Regierungsprogramm 2008 – 2013
DE,Deutschland,6,Hessen,41521,CDU,Christlich Demokratische Union,Christian Democratic Union,2009,In Zeiten wie diesen: Stabilität. Kompetenz. Vertrauen. Das Wahlprogramm der CDU Hessen für den Wahlkampf 2009
DE,Deutschland,6,Hessen,41521,CDU,Christlich Demokratische Union,Christian Democratic Union,2013,Gemeinsam auf dem Weg – Ideen für die Zukunft Hessens
DE,Deutschland,6,Hessen,41001,COAL,Koalition:SPD/GRÜNE,Coalition:SPD/GRÜNE,1983,Vereinbarung zwischen SPD und GRÜNEN für die 11. Legislaturperiode
DE,Deutschland,6,Hessen,41001,COAL,Koalition:SPD/GRÜNE,Coalition:SPD/GRÜNE,1991,Koalitionsvereinbarungen für die 13. Wahlperiode des Hessischen Landtags zwischen Grünen & SPD 1991-1995
DE,Deutschland,6,Hessen,41001,COAL,Koalition:SPD/GRÜNE,Coalition:SPD/GRÜNE,1995,Koalitionsvereinbarung für die 14. Wahlperiode des Hessischen Landtags zwischen SPD & Bünsnia 90/ Die Grünen 1995-1999
DE,Deutschland,6,Hessen,41001,COAL,Koalition:CDU/FDP,Coalition:CDU/FDP,1999,Hessen handelt. Chancen nutzen - Zukunft gewinnen
DE,Deutschland,6,Hessen,41001,COAL,Koalition:CDU/FDP,Coalition:CDU/FDP,2003,Unser Versprechen für Hessen. Verantwortung für heute - Visionen für morgen
DE,Deutschland,6,Hessen,41001,COAL,Koalition:SPD/GRÜNE,Coalition:SPD/GRÜNE,2008,Koalitionsvereinbarung
DE,Deutschland,6,Hessen,41001,COAL,Koalition:CDU/FDP,Coalition:CDU/FDP,2009,"Vertrauen, Freiheit, Fortschritt"
DE,Deutschland,6,Hessen,41001,COAL,Koalition:CDU/GRÜNE,Coalition:CDU/GRÜNE,2013,Verlässlich gestalten - Perspektiven eröffnen
DE,Deutschland,6,Hessen,41223,LINKE,Die Linke,The left,2008,Für soziale Gerechtigkeit in Hessen: Menschen vor Profite! Programm zur Landtagswahl am 27. Januar 2008 – Hessen sozial.
DE,Deutschland,6,Hessen,41223,LINKE,Die Linke,The left,2009,Für soziale Gerechtigkeit in Hessen: Menschen vor Profite! Programm zur Landtagswahl am 18. Januar 2009 – Hessen sozial.
DE,Deutschland,6,Hessen,41223,LINKE,Die Linke,The left,2013,100% SOZIAL - auch nach der Wahl
DE,Deutschland,6,Hessen,41420,FDP,Freie Demokratische Partei,Free Democratic Party,1978,Wahlprogramm der F. D. P. Hessen zur Landtagswahl '78
DE,Deutschland,6,Hessen,41420,FDP,Freie Demokratische Partei,Free Democratic Party,1983,Für ein liberales Hessen
DE,Deutschland,6,Hessen,41420,FDP,Freie Demokratische Partei,Free Democratic Party,1987,Hessens Zukunft in bessere Hände
DE,Deutschland,6,Hessen,41420,FDP,Freie Demokratische Partei,Free Democratic Party,1991,Wahlprogramm der F.D.P. Hessen zur Landtagswahl 1991 – Liberales Hessen: Lebendig Tüchtig Frei
DE,Deutschland,6,Hessen,41420,FDP,Freie Demokratische Partei,Free Democratic Party,1995,Das Buch zur Wahl In Hessen 1995
DE,Deutschland,6,Hessen,41420,FDP,Freie Demokratische Partei,Free Democratic Party,1999,Hessens Chancen nutzen – eine bessere Regierung wählen! Ziele setzen – Chancen schaffen
DE,Deutschland,6,Hessen,41420,FDP,Freie Demokratische Partei,Free Democratic Party,2003,Die treibende Kraft in Hessen. Das Wahlprogramm der FDP zur Landtagswahl 2003
DE,Deutschland,6,Hessen,41420,FDP,Freie Demokratische Partei,Free Democratic Party,2008,Programm zur Landtagswahl 2008 – „Hessen stärker machen“
DE,Deutschland,6,Hessen,41420,FDP,Freie Demokratische Partei,Free Democratic Party,2009,Programm zur Landtagswahl 2009 – „Unser Wort gilt“
DE,Deutschland,6,Hessen,41420,FDP,Freie Demokratische Partei,Free Democratic Party,2013,Programm zur Landtagswahl 2013
DE,Deutschland,6,Hessen,41440,FWG,Freie Wählergemeinschaft,Free Voters,2013,Unser Hessen darf nicht sterben
DE,Deutschland,6,Hessen,41111,GRÜNE,Die Grünen,Die Grünen,1982,Denken in Zusammenhängen - Handeln für eine lebenswerte Zukunft
DE,Deutschland,6,Hessen,41111,GRÜNE,Die Grünen,Die Grünen,1983,Denken in Zusammenhängen -Handeln für eine lebenswerte Zukunft
DE,Deutschland,6,Hessen,41111,GRÜNE,Die Grünen,Die Grünen,1987,Jetzt erst recht -Hessen braucht GRÜN
DE,Deutschland,6,Hessen,41113,GRÜNE,Bündnis90/Die Grünen,Alliance'90/Die Grünen,1995,"Landtagswahlprogramm Hessen ´95 – Wer schlau ist, wählt grün."
DE,Deutschland,6,Hessen,41113,GRÜNE,Bündnis90/Die Grünen,Alliance'90/Die Grünen,1999,Landtagswahlprogramm 1999 Bündnis 90/Die Grünen Hessen
DE,Deutschland,6,Hessen,41113,GRÜNE,Bündnis90/Die Grünen,Alliance'90/Die Grünen,2003,Regierungsprogramm zur Landtagswahl am 2. Februar 2003 – Besser Leben in Hessen braucht mehr grün
DE,Deutschland,6,Hessen,41113,GRÜNE,Bündnis90/Die Grünen,Alliance'90/Die Grünen,2008,An morgen denken. Landtagswahlprogramm 2008
DE,Deutschland,6,Hessen,41113,GRÜNE,Bündnis90/Die Grünen,Alliance'90/Die Grünen,2009,Landtagswahlprogramm 2009 – Für Hessen: Ökologisch. Sozial. Kompetent.
DE,Deutschland,6,Hessen,41113,GRÜNE,Bündnis90/Die Grünen,Alliance'90/Die Grünen,2013,Hessen will den Wechsel
DE,Deutschland,6,Hessen,41950,Pirate,Piratenpartei Deutschland,Pirate Party Germany,2013,Landtagswahl 2013 Wahlprogramm
DE,Deutschland,6,Hessen,41320,SPD,Sozialdemokratische Partei Deutschlands,Social Democratic Party of Germany,1978,Hessen bleibt sozial und frei.
DE,Deutschland,6,Hessen,41320,SPD,Sozialdemokratische Partei Deutschlands,Social Democratic Party of Germany,1982,Hessen bleibt sozial und frei.
DE,Deutschland,6,Hessen,41320,SPD,Sozialdemokratische Partei Deutschlands,Social Democratic Party of Germany,1983,Darum geht's: Hessen wieder vorn! Schafft klare Verhältnisse. SPD
DE,Deutschland,6,Hessen,41320,SPD,Sozialdemokratische Partei Deutschlands,Social Democratic Party of Germany,1983,Hessisches Regierungsprogramm
DE,Deutschland,6,Hessen,41320,SPD,Sozialdemokratische Partei Deutschlands,Social Democratic Party of Germany,1987,Hessen muß vorn bleiben
DE,Deutschland,6,Hessen,41320,SPD,Sozialdemokratische Partei Deutschlands,Social Democratic Party of Germany,1991,Verantwortung ´91. Sozialdemokratisches Regierungsprogramm 1991 – 1995
DE,Deutschland,6,Hessen,41320,SPD,Sozialdemokratische Partei Deutschlands,Social Democratic Party of Germany,1995,"Verantwortung für Hessen. Hessen – Land der wirtschaftlichen Stärke, ökologischen Erneuerung und der sozialen Gerechtigkeit. Sozialdemokratisches Regierungsprogramm 1995 bis 1999"
DE,Deutschland,6,Hessen,41320,SPD,Sozialdemokratische Partei Deutschlands,Social Democratic Party of Germany,1999,Volle Kraft für Hessen! Sozialdemokratisches Regierungsprogramm 1999 bis 2003
DE,Deutschland,6,Hessen,41320,SPD,Sozialdemokratische Partei Deutschlands,Social Democratic Party of Germany,2003,Weil es um Menschen geht. Chancen einer neuen Zeit
DE,Deutschland,6,Hessen,41320,SPD,Sozialdemokratische Partei Deutschlands,Social Democratic Party of Germany,2008,Die Zeit ist reif für eine neue Politik in Hessen. Sozialdemokratisches Regierungsprogramm 2008 – 2013.
DE,Deutschland,6,Hessen,41320,SPD,Sozialdemokratische Partei Deutschlands,Social Democratic Party of Germany,2009,Die Zeit ist reif für eine neue Politik in Hessen. Sozialdemokratisches Regierungsprogramm 2008 – 2013.
DE,Deutschland,6,Hessen,41320,SPD,Sozialdemokratische Partei Deutschlands,Social Democratic Party of Germany,2013,Sozialdemokratisches Regierungsprogramm für Hessen 2014-2019
