country_abbr,country_name,region_code,region_name,cmpcode,acronym,party_orig,party_engl,year,mani_title
ES,Spain,4,Castilla-La Mancha,33967,Cs,Ciudadanos,Citizens,2015,
ES,Spain,4,Castilla-La Mancha,33220,IU,Izquierda Unida,United Left,2015,Es tiempo de Izquierda
ES,Spain,4,Castilla-La Mancha,33210,Pod,Podemos,We Can,2015,Medidas para el cambio en Castilla La Mancha
ES,Spain,4,Castilla-La Mancha,33610,PP,Partido Popular,Popular Party,2015,Trabajar. Hacer. Crecer.
ES,Spain,4,Castilla-La Mancha,33992,UP,Union Progreso y Democracia,Union Progress and Democracy,2015,
